{
  "tripId": "bd528aef-4997-444a-999c-3c9d672c7be5",
  "tripName": "Switzerland & Croatia Honeymoon",
  "startDate": "2026-05-10",
  "endDate": "2026-05-20",
  "days": [
    {
      "dayId": "c7c4897f-06d2-4035-9842-28f2d235c6f5",
      "title": "May 11 — Arrival in Bern",
      "date": "2026-05-11",
      "description": "Arrive Zurich Airport, train to Bern, settle in at Hotel Goldener Schlüssel, see Bern Old Town",
      "isAlternate": false,
      "completed": false,
      "points": [
        {
          "pointId": "dbc1ab2d-e56b-48a4-9e5c-49149f7a9f27",
          "dayId": "c7c4897f-06d2-4035-9842-28f2d235c6f5",
          "type": "travel",
          "title": "Train: Zurich Airport → Bern",
          "startDateTime": "2026-05-11T12:15:00+02:00",
          "endDateTime": "2026-05-11T13:30:00+02:00",
          "confirmationNumber": null,
          "description": "Direct InterCity train from Zurich Airport to Bern. The station is inside the airport terminal — follow signs for **Train / Bahn / SBB**. Buy tickets at an SBB machine or use the SBB Mobile app. No seat reservation needed; trains run frequently.\n\n**Step-by-step:** Exit plane → passport control → skip baggage claim (carry-on only) → follow SBB/Bahn signs to underground station → buy ticket or open SBB app → look for direct InterCity to Bern → board.\n\n**Timing:** Flight arrives 10:50 AM. Allow buffer until ~11:45 AM, target ~12:15 PM train, arrive Bern ~1:15 PM. If you miss one, the next train is fine — do not rush.\n\n*If passport control is slow: take the next train. If you feel disoriented: follow SBB/Bahn signage, not taxi signage. If hungry before boarding: grab something quick at the airport.*",
          "imageUrl": null,
          "logoUrl": null,
          "locations": [
            {
              "locationId": "198ce411-4fc3-4183-a9cf-1a740efc51a6",
              "role": "origin",
              "name": "Zurich Airport Railway Station",
              "lat": 47.461714199999996,
              "lng": 8.550859899999999,
              "fullAddress": "Switzerland",
              "description": "Also shown as Zürich Flughafen. Located inside Zurich Airport; follow signs for Train / Bahn / SBB.",
              "link": null,
              "googlePlaceId": "ChIJfXVSQEJ1kEcRWHaIRtZ3a8Y",
              "googleMapsUri": "https://maps.google.com/?cid=14297653204207826520&g_mp=Cidnb29nbGUubWFwcy5wbGFjZXMudjEuUGxhY2VzLlNlYXJjaFRleHQQAhgEIAA"
            },
            {
              "locationId": "4f790372-afa1-4ef2-ac3b-5d4fc1300f3a",
              "role": "destination",
              "name": "Bern Railway Station",
              "lat": 46.9485269,
              "lng": 7.439914,
              "fullAddress": "Bahnhofpl. 10A, 3011 Bern, Switzerland",
              "description": "Main railway station for Bern; walking distance to Bern Old Town and Hotel Goldener Schlüssel.",
              "link": null,
              "googlePlaceId": "ChIJORjHI785jkcR3Xe8c9B29BY",
              "googleMapsUri": "https://maps.google.com/?cid=1654077600818821085&g_mp=Cidnb29nbGUubWFwcy5wbGFjZXMudjEuUGxhY2VzLlNlYXJjaFRleHQQAhgEIAA"
            }
          ],
          "travelDetail": {
            "mode": "train",
            "operator": null,
            "vehicleNumber": null,
            "cabinClass": null
          },
          "stayDetail": null,
          "completed": false,
          "completedDateTime": null
        },
        {
          "pointId": "c1404396-9405-466d-8729-fd4ad8747869",
          "dayId": "c7c4897f-06d2-4035-9842-28f2d235c6f5",
          "type": "stay",
          "title": "Arrive: Hotel Goldener Schlüssel",
          "startDateTime": "2026-05-11T13:45:00+02:00",
          "endDateTime": "2026-05-11T14:15:00+02:00",
          "confirmationNumber": "58204SG008394",
          "description": "Walk or take a short taxi from Bern station depending on energy. Check in if room is ready — if not, drop bags and keep the afternoon easy. The hotel is in Bern Old Town, exactly where you want to be.\n\n**Confirmation:** 58204SG008394 | **Address:** Rathausgasse 72, 3011 Bern, Switzerland\n\nNearby within easy walking distance: Zytglogge clock tower, Kramgasse (main Old Town street), Bern arcades, Aare River viewpoints.",
          "imageUrl": null,
          "logoUrl": null,
          "locations": [
            {
              "locationId": "2fd0afe2-be23-479e-86c1-abab746580f5",
              "role": "venue",
              "name": "Hotel Goldener Schlüssel",
              "lat": 46.9486227,
              "lng": 7.4487269,
              "fullAddress": "Hotel Goldener Schlüssel, Rathausgasse 72, 3011 Bern, Switzerland",
              "description": null,
              "link": null,
              "googlePlaceId": "ChIJFz1_5sM5jkcRQ9nMjH27cXI",
              "googleMapsUri": "https://maps.google.com/?cid=8246578540599630147&g_mp=Cidnb29nbGUubWFwcy5wbGFjZXMudjEuUGxhY2VzLlNlYXJjaFRleHQQAhgEIAA"
            },
            {
              "locationId": "e4cb29b4-576f-4a5a-a4b7-e7f845f45cc1",
              "role": "venue",
              "name": "Zytglogge",
              "lat": 46.9479581,
              "lng": 7.447792400000001,
              "fullAddress": "Zytglogge, Bim Zytglogge 3, 3011 Bern, Switzerland",
              "description": "Historic medieval clock tower near the hotel.",
              "link": null,
              "googlePlaceId": "ChIJtYNMVME5jkcRVk2Y_GIJan0",
              "googleMapsUri": "https://maps.google.com/?cid=9037045923021606230&g_mp=Cidnb29nbGUubWFwcy5wbGFjZXMudjEuUGxhY2VzLlNlYXJjaFRleHQQAhgEIAA"
            },
            {
              "locationId": "36d2484d-fc00-421b-8fcf-d826dcb1e8ea",
              "role": "venue",
              "name": "Kramgasse",
              "lat": 46.9479785,
              "lng": 7.4505088,
              "fullAddress": "Kramgasse, 3011 Bern, Switzerland",
              "description": "Main historic street in Bern Old Town.",
              "link": null,
              "googlePlaceId": "ChIJT8mAhcM5jkcRdfWIbdAr-lI",
              "googleMapsUri": "https://maps.google.com/?cid=5979139629478638965&g_mp=Cidnb29nbGUubWFwcy5wbGFjZXMudjEuUGxhY2VzLlNlYXJjaFRleHQQAhgEIAA"
            },
            {
              "locationId": "3c4a5cbd-3fa1-42c1-94fb-e21b6f8e2165",
              "role": "venue",
              "name": "Aare River Viewpoints",
              "lat": 46.9471898,
              "lng": 7.459508899999999,
              "fullAddress": "Grosser Muristalden 6, 3006 Bern, Switzerland",
              "description": "Area-based location; exact viewpoint can vary.",
              "link": null,
              "googlePlaceId": "ChIJ1yUzp1Y5jkcRQcYS67CbmNc",
              "googleMapsUri": "https://maps.google.com/?cid=15535338098774951489&g_mp=Cidnb29nbGUubWFwcy5wbGFjZXMudjEuUGxhY2VzLlNlYXJjaFRleHQQAhgEIAA"
            }
          ],
          "travelDetail": null,
          "stayDetail": {
            "stayType": "hotel",
            "checkInTime": null,
            "checkOutTime": null,
            "roomType": null
          },
          "completed": false,
          "completedDateTime": null
        },
        {
          "pointId": "6896a4de-bad9-4496-8374-6e03a32d54eb",
          "dayId": "c7c4897f-06d2-4035-9842-28f2d235c6f5",
          "type": "activity",
          "title": "Lunch Options in Bern",
          "startDateTime": "2026-05-11T14:15:00+02:00",
          "endDateTime": "2026-05-11T15:15:00+02:00",
          "confirmationNumber": null,
          "description": "Casual first lunch after arrival. Keep it simple and close — the win is sitting down and resetting after an overnight flight. Pick based on energy:\n\n- **Kornhauskeller** (Kornhausplatz 18) — historic vaulted setting; the 'we made it to Switzerland' choice if you have energy.\n- **Café Einstein** (Kramgasse 49) — classic relaxed café, coffee and light lunch; best if exhausted.\n- **Beaulieu Bistro Bar** (Erlachstrasse 3) — more local and less touristy; worth it if you want to avoid the tourist strip.\n\nNo reservation needed for any of these.",
          "imageUrl": null,
          "logoUrl": null,
          "locations": [
            {
              "locationId": "436bf7db-be27-4ff2-9c57-ca1c53f27463",
              "role": "venue",
              "name": "Kornhauskeller",
              "lat": 46.948730399999995,
              "lng": 7.4472694,
              "fullAddress": "Kornhauspl. 18, 3011 Bern, Switzerland",
              "description": "Historic restaurant setting; good for a memorable but still easy first lunch.",
              "link": null,
              "googlePlaceId": "ChIJt52vQ8E5jkcR5sQbczMLN38",
              "googleMapsUri": "https://maps.google.com/?cid=9166807882138371302&g_mp=Cidnb29nbGUubWFwcy5wbGFjZXMudjEuUGxhY2VzLlNlYXJjaFRleHQQAhgEIAA"
            },
            {
              "locationId": "0d4c5007-c749-46dc-9036-21ef44b81e9a",
              "role": "venue",
              "name": "Café Einstein",
              "lat": 46.9478097,
              "lng": 7.4499341999999995,
              "fullAddress": "Kramgasse 49, 3011 Bern, Switzerland",
              "description": "Relaxed café option near the hotel and Old Town walk.",
              "link": null,
              "googlePlaceId": "ChIJDe4EicM5jkcRYIXq2P0LA4E",
              "googleMapsUri": "https://maps.google.com/?cid=9296287240716715360&g_mp=Cidnb29nbGUubWFwcy5wbGFjZXMudjEuUGxhY2VzLlNlYXJjaFRleHQQAhgEIAA"
            },
            {
              "locationId": "c9a9671d-cea1-4c15-a2cb-980f6c971003",
              "role": "venue",
              "name": "Beaulieu Bistro Bar",
              "lat": 46.9513135,
              "lng": 7.4344627,
              "fullAddress": "Erlachstrasse 3, 3012 Bern, Switzerland",
              "description": "More local-feeling bistro option; a bit farther from the hotel than the Old Town options.",
              "link": null,
              "googlePlaceId": "ChIJKfztq705jkcRqUKP91pqWU8",